hitachi,05-02-2024 12:09,1706528255-1,Scrum Master IRC209210,https://careers.hitachi.com/jobs/13885343-scrum-master-irc209210,,,,,,https://careers.hitachi.com/search/jobs/in/country/india,https://www.hitachi.com/image/en/r1/common2/corp_id.png,,,,"Description:

8-9 years of IT experience with software development and Scrum Master.

Experienced as Scrum Master in scaled agile frameworks

Subject matter expert of Scrum in addition to extensive knowledge of other Agile development approaches and practices

Experience with Jira project management tools and implementation of best practices in Agile tools and workflows.

Bachelor's degree required in a technical or business-related field

A Scrum Master Certification is a plus

Skills

Effective communicator with excellent verbal and written communication skills. Must be comfortable communicating with development teams, Product Owners, Product Management, and Senior Management.

Effective facilitation and conflict resolution skills - must be able to facilitate discussion of multiple approaches and drive resolution.

Effective influencer, able to work upward and across teams to build rapport and partner with others to solve common problems.

High level of personal accountability, as evidenced by their commitment, resilience, ownership, and mindset toward continuous learning.

Continual improvement - must be constantly growing ones craft, learning new tools and techniques, and sharing these within and among teams.

Assertive - must be able to ensure Agile/Scrum concepts and principles are adhered to, must be able to be a voice of reason and authority, and make the tough calls.

Ability to facilitate, understand, and contribute to technical discussions.

High motivation and drive to help the program teams excel and deliver based on program timelines.

Understand that their role in the organization is broader than the details included in this particular job description.

Excellent interpersonal skills - ability to work with diverse personality types.

Requirements:

8-9 years of IT experience with software development and Scrum Master.

Experienced as Scrum Master in scaled agile frameworks

Subject matter expert of Scrum in addition to extensive knowledge of other Agile development approaches and practices

Experience with Jira project management tools and implementation of best practices in Agile tools and workflows.

Bachelor's degree required in a technical or business-related field

A Scrum Master Certification is a plus

Skills

Effective communicator with excellent verbal and written communication skills. Must be comfortable communicating with development teams, Product Owners, Product Management, and Senior Management.

Effective facilitation and conflict resolution skills - must be able to facilitate discussion of multiple approaches and drive resolution.

Effective influencer, able to work upward and across teams to build rapport and partner with others to solve common problems.

High level of personal accountability, as evidenced by their commitment, resilience, ownership, and mindset toward continuous learning.

Continual improvement - must be constantly growing ones craft, learning new tools and techniques, and sharing these within and among teams.

Assertive - must be able to ensure Agile/Scrum concepts and principles are adhered to, must be able to be a voice of reason and authority, and make the tough calls.

Ability to facilitate, understand, and contribute to technical discussions.

High motivation and drive to help the program teams excel and deliver based on program timelines.

Understand that their role in the organization is broader than the details included in this particular job description.

Excellent interpersonal skills - ability to work with diverse personality types.

Job Responsibilities:

Serve as a Scrum Master for multiple teams across the program where required

Assist in overall program/project planning and ensure cross-team dependencies are well-understood and modeled in project plans and timelines

Identify, document, and publish risks and issues related to the overall program and to define resolution paths where required.

Resolve cross-team impediments and blocking issues.

Collect and consolidate cross-team status for delivery to stakeholders and executive management.

Schedule and conduct meetings and ceremonies in accordance with best practices for Agile/Scrum software development.

Responsible for building team collaboration, commitment towards achieving sprint objectives and viewing team needs above everything else.

Continuously work to improve team performance and productivity:

Encourage team accountability, self-organization, and empowerment.

Remove impediments and coach the scrum team on removing impediments

Share common Agile practices.

Promote and support the development team's automated processes.

Facilitate Retrospectives which generate new ideas for process improvement.

Resolve conflicts and issues that occur

Maintain relevant metrics that guide the development team to more efficient processes in their work and in satisfying their Product Owner and internal stakeholders

Support the Product Owner and provide education where needed

What We Offer

Exciting Projects: We focus on industries like High-Tech, communication, media, healthcare, retail and telecom. Our customer list is full of fantastic global brands and leaders who love what we build for them.

Collaborative Environment: You Can expand your skills by collaborating with a diverse team of highly talented people in an open, laidback environment - or even abroad in one of our global centers or client facilities! 

Work-Life Balance: GlobalLogic prioritizes work-life balance, which is why we offer flexible work schedules, opportunities to work from home, and paid time off and holidays.

Professional Development: Our dedicated Learning & Development team regularly organizes Communication skills training(GL Vantage, Toast Master),Stress Management program, professional certifications, and technical and soft skill trainings.

Excellent Benefits: We provide our employees with competitive salaries, family medical insurance, Group Term Life Insurance, Group Personal Accident Insurance , NPS(National Pension Scheme ), Periodic health awareness program, extended maternity leave, annual performance bonuses, and referral bonuses.

Fun Perks: We want you to love where you work, which is why we host sports events, cultural activities, offer food on subsidies rates, Corporate parties. Our vibrant offices also include dedicated GL Zones, rooftop decks and GL Club where you can drink coffee or tea with your colleagues over a game of table and offer discounts for popular stores and restaurants!

About GlobalLogic

GlobalLogic is a leader in digital engineering. We help brands across the globe design and build innovative products, platforms, and digital experiences for the modern world.

By integrating experience design, complex engineering, and data expertise-we help our clients imagine what's possible, and accelerate their transition into tomorrow's digital businesses.

Headquartered in Silicon Valley, GlobalLogic operates design studios and engineering centers around the world, extending our deep expertise to customers in the automotive, communications, financial services, healthcare and life sciences, manufacturing, media and entertainment, semiconductor, and technology industries.

GlobalLogic is a Hitachi Group Company operating under Hitachi, Ltd. (TSE: 6501) which contributes to a sustainable society with a higher quality of life by driving innovation through data and technology as the Social Innovation Business.",,"Job ID: IRC209210

                            Date Posted: Jan 25, 2024

                            Segment: Digital System & Service

                            Business Unit: Hitachi Services & Platforms

                            Company Name: GlobalLogic

                            Profession (Job Category): Engineering

                            Job Type (Experience Level): Management

                            Job Schedule: Full-Time

                            Remote: Yes",,0
hitachi,05-02-2024 12:09,1706528258-2,Enterprise Architect IRC209208,https://careers.hitachi.com/jobs/13885344-enterprise-architect-irc209208,,,,,,https://careers.hitachi.com/search/jobs/in/country/india,https://www.hitachi.com/image/en/r1/common2/corp_id.png,,,,"Description:

Evaluating internal functions, business development strategies and IT processes and suggesting improvements
Creating business architecture models to reflect the organization's strategies and goals and creating and implementing business visions and goals
Evaluating systems engineering, talent recruiting and accounting models for discrepancies and vulnerabilities
Participate in deep architectural discussions with customers, partners and engineering teams to ensure solutions are designed for successful deployment in the cloud.
Suggesting ideas to reduce costs in IT and business leadership
Organizing training to improve employees' knowledge and skills for future organizational growth
Conducting research in talent management to improve the organization's business operations
Providing business architecture and systems processing guidance
Ensuring the efficiency, security, and support of the organization's goals
Creating methods for compliance architecture, such as data storage, metadata management and change control
Author and contribute to customer-facing publications such as Solution Architectures, whitepapers, Design Guides, handbooks, short videos and presentations.
Build deep relationships with senior technical individuals within customers to enable them to be cloud advocates.
Act as a technical liaison between customers, service engineering teams and support
Participate in all phases of the software development life cycle utilizing Agile Scrum methodology in the creation of new software products.
Collaborate with business analysts, product managers and other development engineers in the design and evolution of software solutions that support any and all types of financial transactions in higher education.
Adhere to the highest standards to insure the security and reliability of applications

Requirements:

An Enterprise Architect is responsible for ensuring that a company can reach its business goals by designing and maintaining its technology infrastructure. This includes aligning technology with business goals, managing the technology life cycle, and ensuring the organisation's technology is scalable, secure, and efficient. Enterprise Architects also ensure that the technology is secure and efficient and can grow as the company grows. They also help to plan and supervise the building of new technology systems and software.

Strong understanding of business operations and strategiesThorough knowledge of technology and its applicationsExperience in designing and implementing technology infrastructureExcellent leadership and communication abilitiesThe capacity to manage and prioritise multiple projectsKnowledge of industry standards and regulationsA bachelor's or master's degree in computer science, information technology, or software engineeringProven work experience as an Enterprise Architect or similar roleExcellent technical, analytical, problem-solving and project management skillsExperience in modeling and graphic representationsBachelor's degree in information technology is preferredExperience implementing continuous deployment/integration development methodologiesStrong understanding for high-availability architectures and business continuityA passion for learning new technologies
Job Responsibilities:

Evaluating internal functions, business development strategies and IT processes and suggesting improvements
Creating business architecture models to reflect the organization's strategies and goals and creating and implementing business visions and goals
Evaluating systems engineering, talent recruiting and accounting models for discrepancies and vulnerabilitiesParticipate in deep architectural discussions with customers, partners and engineering teams to ensure solutions are designed for successful deployment in the cloud.Suggesting ideas to reduce costs in IT and business leadershipOrganizing training to improve employees' knowledge and skills for future organizational growthConducting research in talent management to improve the organization's business operationsProviding business architecture and systems processing guidanceEnsuring the efficiency, security, and support of the organization's goalsCreating methods for compliance architecture, such as data storage, metadata management and change controlAuthor and contribute to customer-facing publications such as Solution Architectures, whitepapers, Design Guides, handbooks, short videos and presentations.Build deep relationships with senior technical individuals within customers to enable them to be cloud advocates.Act as a technical liaison between customers, service engineering teams and supportParticipate in all phases of the software development life cycle utilizing Agile Scrum methodology in the creation of new software products.Collaborate with business analysts, product managers and other development engineers in the design and evolution of software solutions that support any and all types of financial transactions in higher education.Adhere to the highest standards to insure the security and reliability of applications
What We Offer

Exciting Projects: We focus on industries like High-Tech, communication, media, healthcare, retail and telecom. Our customer list is full of fantastic global brands and leaders who love what we build for them.

Collaborative Environment: You Can expand your skills by collaborating with a diverse team of highly talented people in an open, laidback environment - or even abroad in one of our global centers or client facilities! 

Work-Life Balance: GlobalLogic prioritizes work-life balance, which is why we offer flexible work schedules, opportunities to work from home, and paid time off and holidays.

Professional Development: Our dedicated Learning & Development team regularly organizes Communication skills training(GL Vantage, Toast Master),Stress Management program, professional certifications, and technical and soft skill trainings.

Excellent Benefits: We provide our employees with competitive salaries, family medical insurance, Group Term Life Insurance, Group Personal Accident Insurance , NPS(National Pension Scheme ), Periodic health awareness program, extended maternity leave, annual performance bonuses, and referral bonuses.

Fun Perks: We want you to love where you work, which is why we host sports events, cultural activities, offer food on subsidies rates, Corporate parties. Our vibrant offices also include dedicated GL Zones, rooftop decks and GL Club where you can drink coffee or tea with your colleagues over a game of table and offer discounts for popular stores and restaurants!

About GlobalLogic

GlobalLogic is a leader in digital engineering. We help brands across the globe design and build innovative products, platforms, and digital experiences for the modern world.

By integrating experience design, complex engineering, and data expertise-we help our clients imagine what's possible, and accelerate their transition into tomorrow's digital businesses.

Headquartered in Silicon Valley, GlobalLogic operates design studios and engineering centers around the world, extending our deep expertise to customers in the automotive, communications, financial services, healthcare and life sciences, manufacturing, media and entertainment, semiconductor, and technology industries.

GlobalLogic is a Hitachi Group Company operating under Hitachi, Ltd. (TSE: 6501) which contributes to a sustainable society with a higher quality of life by driving innovation through data and technology as the Social Innovation Business.",,"Job ID: IRC209208

                            Date Posted: Jan 25, 2024

                            Segment: Digital System & Service

                            Business Unit: Hitachi Services & Platforms

                            Company Name: GlobalLogic

                            Profession (Job Category): Technology

                            Job Type (Experience Level): Senior Management

                            Job Schedule: Full-Time

                            Remote: Yes",,
hitachi,05-02-2024 12:09,1706528262-3,Automation QE Cypress IRC209041,https://careers.hitachi.com/jobs/13885345-automation-qe-cypress-irc209041,,,,,,https://careers.hitachi.com/search/jobs/in/country/india,https://www.hitachi.com/image/en/r1/common2/corp_id.png,,,,"Description:

To deliver high quality automation scripts, execution and test plans, results, etc.. engineering deliverables and guide team with best practices to be highly performant.

You will be 100% hands on delivering QA engineer.

Connect with different teams to understand the requirements.

Convert business specifications into scenarios

Excellent communication skills and ability to work collaboratively with diverse teams and alone.

Working experience in Agile methodology.

Develop and execute test cases, scripts, plans and procedures

Working in an internationally distributed team;

Communicate with PM, PO, other engineers, leads, architects, QA and other colleagues and stakeholders;

Participation on delivering the product roadmap, plannings, creation of estimations;

Thinking out of the box to come up with solutions that scaleand be a success at the team level

Requirements:

1. Test automation expert with 2-3 years experience on extensive progressive knowledge and skills in the area of automated test design and execution using various test automation frameworks (Cypress) and Windows automation.

2. Test Management Automation Tools for UI and Web (Selenium) good to have

3. Work with an agile team and should be able to perform all tasks e.g. manual testing, automation, client communication

4. Sound knowledge of SDLC, Agile, Testing life cycle, testing methodologies and testing techniques.

5. Documents test automation requirements and other test planning artifacts in preparation for test automation design

6. Designs and develops test automation artifacts (scripts, functions, scenarios, processes) for simple to complex automated testing situations using various tools and also experience in frameworks creation for automation

7. Has expert level understanding of complete test automation and various test automation frameworks (i.e. data driven, keyword driven, table driven, hybrid, etc.)

8. Designs, executes, monitors, and troubleshoots automated tests in a variety of situations and conditions

9. Works collaboratively with other departments to understand project objectives, gather automation requirements, design automated tests, troubleshoot issues, and implement scalable test automation solutions

10. Automation of test cases

11. Knowledge Microsoft AD and confluence

12. Execution of automated test cases on daily basis

13. Ability to work both independently and in a team environment.

14. Should have good interpersonal and communication skills.

15. Willing to adapt to new tools or technologies.

16. Database (SSMS) knowledge is needed.

17. Good to have - API automation, Performance Testing and Load Testing experience

Job Responsibilities:

To deliver high quality automation scripts, execution and test plans, results, etc.. engineering deliverables and guide team with best practices to be highly performant.

You will be 100% hands on delivering QA engineer.

Connect with different teams to understand the requirements.

Convert business specifications into scenarios

Excellent communication skills and ability to work collaboratively with diverse teams and alone.

Working experience in Agile methodology.

Develop and execute test cases, scripts, plans and procedures

Working in an internationally distributed team;

Communicate with PM, PO, other engineers, leads, architects, QA and other colleagues and stakeholders;

Participation on delivering the product roadmap, plannings, creation of estimations;

Thinking out of the box to come up with solutions that scaleand be a success at the team level

What We Offer

Exciting Projects: We focus on industries like High-Tech, communication, media, healthcare, retail and telecom. Our customer list is full of fantastic global brands and leaders who love what we build for them.

Collaborative Environment: You Can expand your skills by collaborating with a diverse team of highly talented people in an open, laidback environment - or even abroad in one of our global centers or client facilities! 

Work-Life Balance: GlobalLogic prioritizes work-life balance, which is why we offer flexible work schedules, opportunities to work from home, and paid time off and holidays.

Professional Development: Our dedicated Learning & Development team regularly organizes Communication skills training(GL Vantage, Toast Master),Stress Management program, professional certifications, and technical and soft skill trainings.

Excellent Benefits: We provide our employees with competitive salaries, family medical insurance, Group Term Life Insurance, Group Personal Accident Insurance , NPS(National Pension Scheme ), Periodic health awareness program, extended maternity leave, annual performance bonuses, and referral bonuses.

Fun Perks: We want you to love where you work, which is why we host sports events, cultural activities, offer food on subsidies rates, Corporate parties. Our vibrant offices also include dedicated GL Zones, rooftop decks and GL Club where you can drink coffee or tea with your colleagues over a game of table and offer discounts for popular stores and restaurants!

About GlobalLogic

GlobalLogic is a leader in digital engineering. We help brands across the globe design and build innovative products, platforms, and digital experiences for the modern world.

By integrating experience design, complex engineering, and data expertise-we help our clients imagine what's possible, and accelerate their transition into tomorrow's digital businesses.

Headquartered in Silicon Valley, GlobalLogic operates design studios and engineering centers around the world, extending our deep expertise to customers in the automotive, communications, financial services, healthcare and life sciences, manufacturing, media and entertainment, semiconductor, and technology industries.

GlobalLogic is a Hitachi Group Company operating under Hitachi, Ltd. (TSE: 6501) which contributes to a sustainable society with a higher quality of life by driving innovation through data and technology as the Social Innovation Business.",,"Job ID: IRC209041

                            Date Posted: Jan 25, 2024

                            Segment: Digital System & Service

                            Business Unit: Hitachi Services & Platforms

                            Company Name: GlobalLogic

                            Profession (Job Category): Quality Assurance

                            Job Type (Experience Level): Experienced

                            Job Schedule: Full-Time

                            Remote: Yes",,
